{
  "schema_version": "1.0.0",
  "run_id": "demo-run",
  "plan": {
    "path": "plan/workflow.plan.json",
    "sha256": "0000000000000000000000000000000000000000000000000000000000000000",
    "schema_version": "0.5"
  },
  "target": {
    "harness": "codex",
    "version": null
  },
  "capabilities": {
    "source": "official-docs-and-local-probe",
    "snapshot_sha256": "0000000000000000000000000000000000000000000000000000000000000000",
    "features": {
      "subagents": "supported",
      "worktree-isolation": "unknown",
      "structured-handoffs": "unsupported"
    }
  },
  "profile": {
    "id": "feature-pipeline",
    "version": "1.0.0"
  },
  "workers": [
    {
      "worker_id": "explore",
      "native_agent": "kp_explorer",
      "role": "explorer",
      "read_scope": [
        "**/*"
      ],
      "write_scope": []
    },
    {
      "worker_id": "implement",
      "native_agent": "kp_implementer",
      "role": "implementer",
      "read_scope": [
        "**/*"
      ],
      "write_scope": [
        "src/auth/**"
      ]
    }
  ],
  "claims": [
    {
      "claim_id": "demo-behavior",
      "statement": "The requested behavior is implemented.",
      "falsifier": "A focused test or review contradicts the behavior.",
      "required_evidence": [
        "command:focused-test",
        "review:correctness"
      ],
      "minimum_assurance": "A1-local-observed",
      "evaluator": "command-and-review-policy-v1",
      "hard": true
    }
  ],
  "risk_gates": [
    {
      "gate_id": "network",
      "trigger": "network action requested",
      "safe_default": "deny",
      "required": true
    }
  ],
  "budgets": [
    {
      "name": "max_invocations",
      "limit": 4,
      "unit": "invocations",
      "policy": "hard",
      "observable": true
    }
  ],
  "compile_report_sha256": "0000000000000000000000000000000000000000000000000000000000000000"
}
